,Brand,Variety,Style,Country,Stars
1162,Chewy,Instant Rice Vermicelli Original Flavour,Pack,Hong Kong,0.5
1163,Paldo,Cheese Ramyun (for US market),Pack,South Korea,5.0
1164,Chering Chang,Curry La-Men,Pack,Taiwan,5.0
1165,Chewy,Non-Fried Ramen Noodles Taiwan Roast Pork Flavour,Pack,Hong Kong,4.0
1166,A-Sha Dry Noodle,Prince Katsu Snack Noodles,Pack,Taiwan,4.0
1167,Adabi,Mi Segera Tom Yam Instant Noodles,Pack,Malaysia,3.25
1168,Baixiang Noodles,Spicy Artificial Beef Flavour Instant Noodles With Soup Base,Pack,China,3.5
1169,Pamana,Chicken Sopas Creamy Macaroni Soup,Cup,Philippines,3.5
1170,Annie Chun's,Ramen House Thai Coconut Ramen,Pack,United States,5.0
1171,La Fonte,Spaghetti With Mushroom Sauce,Pack,Indonesia,3.75
1172,Maggi,Masala Dumdaar Noodles,Pack,India,3.75
1173,Thai Choice,Instant Noodles Seafood Flavour,Cup,Thailand,4.0
1174,Tesco,Everyday Value Chicken & Mushroom Flavour,Cup,UK,0.5
1175,Pop Bihun,Spesial Rasa Kari Ayam Pedas,Pack,Indonesia,3.75
1176,Myojo,Yomise No Yakisoba Shiodare Flavor With Black Pepper Mayonnaise,Tray,Japan,3.75
1177,Pulmuone,Nature Is Delicious Non-Fried Ramyun (Spicy Flavor) (New Version),Pack,South Korea,3.75
1178,Vina Acecook,Oh! Ricey Pho Bo Instant Rice Noodles,Bowl,Vietnam,3.75
1179,Nissin,Fried Noodle Specialist Tom Yam Mee Goreng Flavour,Pack,Singapore,3.0
1180,Wu-Mu,Steam Seafood Flavor Ramen,Pack,Taiwan,4.0
1181,Oyatsu,Baby Star Snack Noodle Yakisoba Flavor,Pack,Japan,4.75
1182,Snapdragon,Singapore Laksa Curry Soup Bowl,Bowl,United States,4.25
1183,Paldo,Mild Kokomen (Prototype),Pack,South Korea,4.5
1184,Saji,Sajimee Curry Soup Flavour,Pack,Malaysia,4.25
1185,Miracle Noodle,Miso Marvellous Soup,Pack,United States,4.0
1186,Shan,Shoop Instant Noodles Chicken Flavour,Pack,Pakistan,3.5
1187,Indomie,Mi Goreng Rasa Iga Penyet,Pack,Indonesia,4.75
1188,Tiger Tiger,Traveller's Choice Thai Red Curry Flavour Instant Noodles,Pack,UK,1.75
1189,Paldo,Barbecue Ramyun (Prototype),Pack,South Korea,3.75
1190,Takamori Kosan,Red Pepper 7 Garlic Peperoncino,Pack,Japan,4.0
1191,Takamori Kosan,Sukiyaki Style Noodle Stew,Pack,Japan,4.5
1192,Takamori Kosan,Yaki-Udon Roast Soy Sauce,Pack,Japan,3.75
1193,Takamori Kosan,Hiyashi Udon Bonito Sauce,Pack,Japan,3.0
1194,Takamori Kosan,Futomen Yakisoba,Pack,Japan,4.75
1195,Takamori Kosan,Hiyashi Chuka Lemon Sauce,Pack,Japan,4.75
1196,Takamori Kosan,Curry Udon,Pack,Japan,5.0
1197,Takamori Kosan,Chanpon,Pack,Japan,3.75
1198,Takamori Kosan,Shio Yakisoba,Pack,Japan,4.0
1199,Takamori Kosan,Yakisoba,Pack,Japan,5.0
1200,Takamori Kosan,Yaki-Udon Mild Spicy Sauce,Pack,Japan,4.25
1201,Takamori Kosan,Katsuo Dashi Udon,Pack,Japan,3.75
1202,Takamori Kosan,Spaghetti Napolitan,Pack,Japan,4.0
1203,Tokyo Noodle,Spicy Garlic Ramen,Pack,Japan,3.25
1204,Tesco,Everyday Value Beef & Tomato Flavour Noodles,Cup,UK,2.0
1205,Samyang Foods,Nagasaki Jjamppong,Cup,South Korea,3.75
1206,Campbell's,Hearty Noodles Thai Flavour,Cup,Canada,0.0
1207,Papa,Oriental Style Instant 'Kua-Chap',Pack,Thailand,3.25
1208,A-Sha Dry Noodle,Hello Kitty Za Jiang (Soybean Sauce),Pack,Taiwan,3.25
1209,Nissin,Soba Teriyaki Noodles With Japanese Yakisoba Sauce,Cup,Germany,3.0
1210,Sawadee,Instant Noodles Vegetable & Mushroom Flavour,Pack,UK,1.5
1211,Nongshim,Sir Long Tang Creamy Beef Noodle Soup,Cup,United States,4.25
1212,Four Seas,Seaweed Hot & Spicy Instant Noodle Mushroom & Beef Flavour,Bowl,Hong Kong,3.5
1213,Golden Wheat,Korean Style Stew Pork Flavour Noodle Soup,Bowl,China,1.75
1214,Sau Tao,Instant Noodle King Won Ton Flavor,Pack,Hong Kong,2.75
1215,Mamee,Instant Noodles Curry Flavour,Pack,Malaysia,3.5
1216,Mamee,Chef Creamy Tom Yam Flavour,Pack,Malaysia,5.0
1217,Mamee,Monster BBQ Flavour Snack Noodles,Pack,Malaysia,3.75
1218,Mamee,Chef Curry Laksa Flavour,Cup,Malaysia,5.0
1219,Mamee,SLLRRRP! Asam Laksa,Pack,Malaysia,4.0
1220,Mamee,Mie Goreng Indonesia Spicy Sambal,Cup,Malaysia,5.0
1221,Mamee,Chef Spicy Chicken Shiitake Flavour,Pack,Malaysia,3.25
1222,Mamee,Instant Vermicelli Chicken Flavour,Pack,Malaysia,3.25
1223,Mamee,Chef Creamy Tom Yam Flavour,Cup,Malaysia,4.75
1224,Mamee,Instant Noodles Vegetarian Flavour,Pack,Malaysia,3.75
1225,Mamee,SLLRRRP! Kari Berapi,Pack,Malaysia,3.75
1226,Mamee,Monster Chicken Flavour Snack Noodles,Pack,Malaysia,4.0
1227,Mamee,Chef Curry Laksa Flavour,Pack,Malaysia,5.0
1228,Mamee,Mie Goreng Indonesia Original Flavour,Cup,Malaysia,4.5
1229,Mamee,Instant Vermicelli Tom Yam Flavour,Pack,Malaysia,3.75
1230,Paldo,Bulnak Bokkummyun Spicy Fried Octopus Ramyun,Pack,South Korea,4.0
1231,Oyatsu,Baby Star Ramen Round Consomme Mini,Pack,Japan,3.75
1232,Lotus Foods,Forbidden Rice Ramen,Pack,United States,2.25
1233,Lotus Foods,Millet & Brown Rice Ramen,Pack,United States,4.0
1234,Lotus Foods,Jade Pearl Rice Ramen,Pack,United States,3.25
1235,Ah Lai,White Curry Noodle,Pack,Malaysia,4.5
1236,Plats Du Chef,Cuisine Adventures Chicken Pho Soup,Bowl,Canada,5.0
1237,Indomie,Taste Of Asia Mi Goreng Rasa Bulgogi Ala Korea,Pack,Indonesia,2.75
1238,Kin-Dee,Instant Rice Noodle Pad Thai,Tray,Thailand,3.75
1239,Batchelors,Super Noodles Peppered Steak Flavour,Pack,UK,1.5
1240,Sakura Noodle,Chikara Brand Udon Beef Flavor,Pack,United States,4.25
1241,Shirakiku,Fresh Chow Mein Noodles With Seasoning,Pack,United States,3.75
1242,Sakura Noodle,Chikara Brand Udon Hot & Spicy Flavor,Pack,United States,4.0
1243,Sakura Noodle,Chikara Brand Udon Mushroom Flavor,Pack,United States,3.75
1244,Sakura Noodle,Chikara Brand Udon Oriental Flavor,Pack,United States,3.75
1245,Sakura Noodle,Chikara Brand Udon Chicken Flavor,Pack,United States,3.75
1246,Indomie,Taste Of Asia Mi Kuah Rasa Tom Yum Ala Thailand,Pack,Indonesia,3.75
1247,Sapporo Ichiban,Otafuku Okonomi Sauce Yakisoba,Tray,Japan,5.0
1248,Vifon,Oriental Style Instant Noodle Mi Ga Chicken Flavor,Cup,Vietnam,1.25
1249,A-Sha Dry Noodle,Hello Kitty La Wei (Spicy Flavor),Pack,Taiwan,3.75
1250,Unif,Unif-100 Instant Noodles Artificial Tart Beef Flavor,Pack,China,3.0
1251,Mamee,Mi Segera SLLRRRP! Perencah Kari Xtra Pedas,Pack,Malaysia,3.75
1252,Koka,Spicy Shrimp Tom Yam Flavour,Cup,Singapore,3.25
1253,Ruski,Instant Noodles Stewed Beef Flavour,Pack,Thailand,3.5
1254,Golden Wheat,Korean Style Mushroom Chicken Flavour Cooking Noodle,Pack,China,2.0
1255,Hi-Myon,Instant Noodle Udon Hot & Spicy,Pack,South Korea,4.0
1256,Takamori Kosan,Fresh Chow Mein Noodles With Seasoning,Pack,Japan,3.75
1257,Mama,Instant Noodles Cup Seafood Flavour,Cup,Thailand,3.75
1258,Adabi,Mi Segera Kari Ayam Instant Noodles,Pack,Malaysia,4.25
1259,Nissin,Spa Oh Tarako Spaghetti,Bowl,Japan,4.0
1260,Ve Wong,Little Prince Brand Snack Noodles Original Flavor,Pack,Taiwan,2.5
1261,Ottogi,Japchae Vermicelli Noodle,Pack,South Korea,2.75
1262,Sainsbury's,Chicken Flavour Instant Noodles,Pack,UK,2.75
1263,Paldo,Korean Traditional Beef Gomtangmen,Pack,South Korea,5.0
1264,Healtimie,Green Barley Noodle Vegetable Soup,Pack,Indonesia,3.25
1265,Maruchan,I Want To Eat Ramen Miso Flavor,Pack,Japan,3.75
1266,Pop Bihun,Spesial Rasa Soto Ayam,Pack,Indonesia,4.0
1267,Thai Kitchen,Rice Noodle Cart Thai Peanut,Tray,United States,3.0
1268,Yum Yum,Oriental Style Instant Noodles Seafood Flavour,Cup,Thailand,3.75
1269,Nongshim,Soon Veggie Noodle Soup,Pack,South Korea,5.0
1270,Nissin,Cup Noodle Cheese Curry,Cup,Japan,3.75
1271,Koka,Oriental Style Instant Noodles Tom Yam Flavour,Pack,Singapore,2.5
1272,A-Sha Dry Noodle,Instant Noodle Original Flavor,Pack,Taiwan,3.75
1273,Nissin,Demae Ramen Shoyu Tonkotsu Artificial Pork Flavour,Pack,Hong Kong,4.75
1274,Western Family,Instant Noodles In A Cup Chicken Flavour,Cup,Canada,1.5
1275,Mama,Instant Noodles Yentafo Tom Yum Mohfai Flavour,Pack,Thailand,5.0
1276,Knorr,Quick Serve Macaroni Shrimp Broth,Pack,Hong Kong,3.25
1277,Samyang Foods,Red Nagasaki Jjampong,Pack,South Korea,5.0
1278,Mr. Noodles,Noodles In A Cup Spicy Chicken Simulated Flavour,Cup,Canada,1.0
1279,Good Tto Leu Foods,Lightning Beef Bone Tteokguk Rice Cake Soup,Bowl,South Korea,4.0
1280,GaGa,Mie Gepeng Kuah Rasa Ayam Lada Hitam,Pack,Indonesia,3.25
1281,Wu-Mu,Ramen With Pickled Mustard Flavor,Pack,Taiwan,3.5
1282,Wu-Mu,Steam Mushroom Flavor Ramen,Pack,Taiwan,3.25
1283,Thai Choice,Instant Noodles Chicken Flavour,Cup,Thailand,3.0
1284,Myojo,Prawn Noodles,Pack,Singapore,4.25
1285,Nissin,Cup Noodles Sabor A Carne Sopa Con Fideos,Cup,Colombia,3.0
1286,A-One,M Ly Instant Noodles M Tm Shrimp Flavor,Cup,Vietnam,3.25
1287,Nongshim,Sain Sain Garlic Teriyaki Fresh Cooked Udon Pasta,Tray,South Korea,4.5
1288,JML,Braised Beef Noodles,Pack,China,4.0
1289,Sau Tao,QQ Scallop Seafood Vermicelli,Bowl,Hong Kong,3.75
1290,Kimura,Kumamoto Tonkotsu Ramen,Pack,Japan,5.0
1291,Batchelors,Super Noodles Roast Beef & Onion Flavour,Pack,UK,3.25
1292,Lucky Me!,Supreme Chow Mein Seafood Flavor Instant Stir-Fried Noodles,Bowl,Philippines,3.25
1293,Thai Kitchen,Rice Noodle Cart Sweet Citrus Ginger,Tray,United States,4.25
1294,Nongshim,Oolongmen Kimchi Cup Noodle Soup Mix,Cup,South Korea,4.0
1295,Koka,Purple Wheat Noodles Aglio Olio,Pack,Singapore,2.75
1296,Tokachimen Koubou,Jet Black Sesame Oil Pork Tonkotsu,Bowl,Japan,2.25
1297,Deshome,Sun Dried Noodle Chlorella Powder Noodle With Curry Sauce,Pack,Taiwan,5.0
1298,Ko-Lee,Instant Noodles Mixed Vegetable,Pack,UK,3.5
1299,Ottogi,Ppushu Ppushu Noodle Snack Bulgogi Flavor,Pack,South Korea,3.25
1300,Vifon,M G Tm Chua Cay Hot & Sour Chicken Flavor Instant Noodles,Pack,Vietnam,2.0
1301,Adabi,Mi Bandung Prawn Mee,Pack,Malaysia,4.25
1302,Wu-Mu,Ramen With Stewed Pork Flavor,Pack,Taiwan,4.5
1303,Wu-Mu,Shiitake Flavor Spinach Ramen,Pack,Taiwan,3.75
1304,Sainsbury's,Basics Instant Noodles Chicken Curry Flavour,Pack,UK,3.25
1305,Samyang Foods,Baked Noodle Spicy Grilled Beef Ramyun,Pack,South Korea,3.5
1306,Prima Taste,Singapore Chilli Crab La Mian,Pack,Singapore,5.0
1307,Ko-Lee,Instant Noodles Taste Sensations Creamy Shrimp Tom Yum Flavour,Pack,UK,5.0
1308,Chewy,Rice Vermicelli Scallop With XO Sauce Flavour,Pack,Hong Kong,2.5
1309,Wu-Mu,Dried Noodle With Jah Jan Sauce,Pack,Taiwan,3.25
1310,ABC,Mi Cup Rasa Soto Ayam Chicken Soto Flavour,Cup,Indonesia,3.75
1311,ABC,Selera Pedas Mi Goreng Cup Rasa Gulai Ayam Pedas Hot Gulai Chicken,Cup,Indonesia,4.0
1312,ABC,Rasa Ayam Bawang Chicken Onion Flavour,Cup,Indonesia,3.75
1313,ABC,Selera Pedas Mi Goreng Cup Rasa Ayam Pedas Limau Hot Chicken Lemon Flavour,Cup,Indonesia,4.25
1314,Nissin,Cup Noodle Curry X Gunpla RX-78-2 Gundam,Cup,Japan,4.25
1315,ABC,Mi Cup Rasa Kari Ayam Chicken Curry Flavour,Cup,Indonesia,3.75
1316,Eat & Go,Rasa Baso Sapi Meat Ball Mi Instan Cup,Cup,Indonesia,3.75
1317,ABC,Mi Goreng Pangsit Fried Noodle With Dumpling,Pack,Indonesia,5.0
1318,Eat & Go,Chicken Onion Mi Instan Cup,Cup,Indonesia,3.75
1319,President,Mi Goreng Rasa Ayam Chicken Flavoured Fried Noodle,Pack,Indonesia,4.5
1320,ABC,Mi Goreng Spesial Special Fried Noodle,Cup,Indonesia,4.0
1321,Eat & Go,Curry Chicken Mi Instan Cup,Cup,Indonesia,4.25
1322,Thai Choice,Instant Noodles Shrimp Flavour,Cup,Thailand,3.25
1323,Four Seas,Sesame Oil Chicken Flavour Instant Noodle,Bowl,Hong Kong,2.75
1324,Nissin,Chow Mein Teriyaki Chicken Flavor Chow Mein Noodles,Tray,United States,3.75
1325,Tesco,Instant Noodles Chow Mein Flavour,Pack,UK,2.25
1326,Mama,Instant Noodles Tom Saab Flavour,Pack,Thailand,3.5
1327,Samyang Foods, (Samyang Ramyun) (South Korean Version),Bowl,South Korea,3.75
1328,Nissin,Sabor A Pollo Sopa Con Fideos,Cup,Colombia,2.75
1329,Wu-Mu,Beef Flavour Tomato Ramen,Pack,Taiwan,4.0
1330,Maruchan,I Want To Eat Ramen Pork Tonkotsu Flavor,Pack,Japan,4.0
1331,Annie Chun's,Ramen House Chicken Vegetable Flavored Ramen,Pack,United States,4.0
1332,Sau Tao,Instant Noodle King Abalone & Chicken Flavoured,Pack,Hong Kong,3.5
1333,Unif,Unif-100 Pickled Cayenne Flavor Beef Ramen,Pack,China,3.75
1334,Nissin,Demae Rice Vermicelli Chicken Flavour Instant Rice Vermicelli With Soup Base,Pack,Hong Kong,1.75
1335,Thai Pavilion,Garlic Chili Instant Rice Noodles & Sauce,Tray,United States,4.0
1336,Nissin,Donbei Kansai Soy Sauce Flavor Udon,Pack,Japan,3.75
1337,Maggi,Big Kari Perencah (Big Curry Flavor) 2 Minute Noodles,Pack,Malaysia,4.0
1338,SuperMi,Rasa Ayam Spesial,Pack,Indonesia,4.0
1339,Sapporo Ichiban,Sesame Ramen,Pack,Japan,5.0
1340,Mama,Instant Noodles Creamy Tom Yum Minced Pork Flavour,Pack,Thailand,3.5
1341,Emart,Dare You Habanero Ramyun,Cup,South Korea,3.25
1342,Nissin,Demae Ramen Miso Tonkotsu Artificial Pork Flavor Ramen Noodle,Pack,Hong Kong,3.75
1343,Sainsbury's,Barbecue Beef Flavour Instant Noodles,Pack,UK,2.75
1344,Nissin,Sabor A Pollo Sopa Instantnea Con Fideos,Pack,Colombia,3.25
1345,GaGa,Mie Gepeng Kuah Rasa Ayam Bawang Pedas,Pack,Indonesia,3.25
1346,A-Sha Dry Noodle,Instant Noodle Shallot Flavor,Pack,Taiwan,3.75
1347,Saji,Sajimee Original Soto Soup Flavor,Pack,Malaysia,4.0
1348,Kumamoto,Tonkotsu Ramen MEGA Dragon,Pack,Japan,2.5
1349,Maruchan,Seimen Japanese Instant Ramen Noodles Shio Aji,Pack,Japan,3.75
1350,Mr. Noodles,Chicken Kimchi Oriental Style Noodles With Soup Base,Bowl,Canada,0.5
1351,Master Kong,Artificial Braised Beef Flavor Instant Noodle,Bowl,China,3.75
1352,Nissin,Pan Asian Kitchen Sweet & Sour Chicken Flavor Ramen Noodles,Tray,United States,3.75
1353,HoMyeonDang,Premium Noodle House Seafood Ramyun,Pack,South Korea,4.0
1354,Sawadee,Instant Noodles Prawn Oriental Flavour,Pack,Malaysia,2.5
1355,Nissin,Soba Classic Noodles With Japanese Yakisoba Sauce,Cup,Germany,3.75
1356,ABC,Selera Pedas Hot Semur Chicken Flavour,Pack,Indonesia,4.5
1357,Nissin,Ultraman Instant Noodle Pork Flavour,Cup,Japan,3.0
1358,Tokyo Noodle,Mini Instant Noodle Spicy Flavor,Pack,Japan,3.5
1359,Sau Tao,Ho Fan Beef Soup Flavored,Pack,China,3.75
1360,Doll,Hello Kitty Dim Sum Noodle Japanese Curry Flavour,Cup,Hong Kong,3.5
1361,Batchelors,Super Low Fat Noodles Chilli Chicken Flavour,Pack,UK,1.0
1362,GaGa,Mi Instan Cup Milk Chicken Soup,Cup,Indonesia,4.75
1363,Eat & Go,Rendang Beef Flavour Fried Instant Noodle,Cup,Indonesia,5.0
1364,Nan Jie Cun,Hot -Dry Instant Noodles Chilli Flavour,Tray,China,0.5
1365,Ruski,Instant Noodles Tom Yum Flavour,Pack,Thailand,3.5
1366,Nissin,Demae Iccho Instant Noodle With Soup Base Artificial Chicken Flavour,Bowl,Hong Kong,3.0
1367,A-Sha Dry Noodle,Hell Spicy Mala,Pack,Taiwan,4.0
1368,Batchelors,Super Noodles Chicken Mushroom Flavour,Pack,UK,3.25
1369,Golden Wheat,Korean Style Stew Prok Flavour Cooking Noodle,Pack,China,3.5
1370,Nissin,UFO Yakisoba With Wasabi Mayonnaise,Bowl,Japan,5.0
1371,China Best,Frozen Satay Sauce Noodle,Pack,Taiwan,1.0
1372,Mama,Instant Noodles Pork Flavour With Black Pepper,Pack,Thailand,3.5
1373,Nissin,Cup Noodles Sabor A Gallina,Cup,Colombia,3.5
1374,GaGa,Mie Gepeng Kuah Rasa Soto Cabe Hijau,Pack,Indonesia,3.5
1375,Sugakiya Foods,Udon Miso Stew,Pack,Japan,3.25
1376,A-Sha Dry Noodle,Instant Noodle Curry Flavour,Pack,Taiwan,4.25
1377,Men-Sunaoshi,Tonkotsu Ramen,Pack,Japan,3.75
1378,Mama,Instant Noodles Chicken Green Curry Flavour,Pack,Thailand,3.75
1379,Samyang Foods,Maesaengyitangmyun Baked Noodle,Pack,South Korea,5.0
1380,Nissin,Cup Noodle Chilli Tomato,Cup,Japan,4.5
1381,Nissin,Bowl Noodles Chicken Flavor,Bowl,United States,3.5
1382,Sawadee,Instant Noodles Spicy Tomato Flavour,Pack,Malaysia,2.5
1383,Paldo,Namja Ramyun (US Version),Bowl,South Korea,4.0
1384,Nissin,Soba Curry Noodles With Japanese Yakisoba Sauce,Cup,Germany,3.75
1385,Wu-Mu,Ramen With Simmered Pork Flavor,Pack,Taiwan,3.75
1386,GaGa,Seribu 1000 Goreng Spesial,Pack,Indonesia,4.0
1387,Sanrio,Hello Kitty Hakata Shoyutonkotsu Ramen,Bowl,Japan,3.75
1388,Acecook,Comet Mori Yukino Tan-tan men,Bowl,Japan,5.0
1389,Chencun,Braised Pork Ribs,Cup,China,3.0
1390,Nongshim,Shin Ramyun Cup,Cup,South Korea,3.5
1391,Nissin,Sabor A Carne Sopa Instantnea Con Fideos,Pack,Colombia,3.75
1392,Sainsbury's,Basics Instant Noodles Chicken Flavour,Pack,UK,3.25
1393,Sapporo Ichiban,Pokemon Shoyu Ramen,Cup,Japan,3.5
1394,Paldo,Cheese Noodle,Pack,South Korea,5.0
1395,Ko-Lee,Go Noodles Xtreme Hot & Spicy Flavour,Pack,UK,3.75
1396,Samyang Foods,Star Popeye Ramyun Snack,Pack,South Korea,4.0
1397,Wei Lih,Whats That? Leisure Meatballs Spicy Chicken Flavor,Pack,Taiwan,3.75
1398,Myojo,Chukazanmai Guangdong Style Ramen,Pack,Japan,4.25
1399,Nongshim,Shin Black Spicy Pot-au-feu Flavor Premium Noodle Soup,Cup,United States,5.0
1400,ABC,Mi ABC Rasa Ayam Bawang (Onion Chicken),Pack,Indonesia,4.0
1401,Maruchan,Old Style Shio Ramen,Pack,Japan,3.5
1402,Healtimie,Green Barley Noodle Milk Chicken Soup,Pack,Indonesia,4.25
1403,Itomen,Crab Flavor Instant Ramen,Pack,Japan,4.0
1404,Pop Bihun,Spesial Goreng Special,Pack,Indonesia,3.5
1405,Koyo,Seaweed Ramen Made With Organic Noodles,Pack,United States,2.75
1406,Tiger Tiger,Traveller's Choice Indian Tikka Masala Flavour,Pack,UK,3.0
1407,Acecook,Jan Jan Yakisoba,Cup,Japan,3.75
1408,Mr. Noodles,Noodles In A Cup Beef Simulated Flavour,Cup,Canada,1.75
1409,Nissin,Donbei Curry Udon (West Japanese),Bowl,Japan,3.25
1410,Kabuto Noodles,Miso Ramen,Cup,UK,3.75
1411,Unif,Man Han Feast Sichuan Chilli Eel Flavor,Bowl,Taiwan,5.0
1412,Nissin,Chow Mein With Shrimp Chow Mein Noodles,Tray,United States,3.75
1413,Mr. Noodles,Bowl Chicken Simulated Flavour,Bowl,Canada,2.0
1414,Chewy,Rice Vermicelli Spicy Beef With Chilli Flavour,Pack,China,3.25
1415,Nissin,Chanpon Ramen,Pack,Japan,4.75
1416,GaGa,100 Green Chilli Soto Flavour,Pack,Indonesia,3.75
1417,Samyang Foods,Chacharoni,Pack,South Korea,3.75
1418,Peyang,Yakisoba,Tray,Japan,5.0
1419,Nissin,Demae Iccho XO Sauce Seafood Flavour,Bowl,Hong Kong,4.0
1420,Golden Wonder,The Nation's Noodle Beef & Tomato Flavour,Cup,UK,4.25
1421,Vifon,Oriental Style Instant Vermicelli Sour Crab Flavour Soup,Pack,Vietnam,3.75
1422,Komforte Chockolates,Savory Ramen ,Bar,United States,5.0
1423,Golden Wheat,Korean Style Shrimp Flavour Cooking Noodle,Pack,China,3.5
1424,Wu-Mu,Spicy Flavor Tomato Ramen,Pack,Taiwan,4.0
1425,Sapporo Ichiban,Tomato & Basil Shio Ramen,Pack,Japan,4.0
1426,Asian Thai Foods,Fatafat Vegetable Flavor,Pack,Nepal,3.75
1427,Asian Thai Foods,Krrish Instant Noodles Chicken Flavor,Pack,Nepal,3.5
1428,Asian Thai Foods,Preeti Instant Noodles Chicken Soup Base,Pack,Nepal,3.5
1429,Asian Thai Foods,Miteri Instant Noodles Vegetable Flavor,Pack,Nepal,3.5
1430,Asian Thai Foods,Rumpum Chicken Soup Base,Pack,Nepal,3.5
1431,Asian Thai Foods,2pm Precooked Noodles Chicken Curry Delight,Pack,Nepal,3.5
1432,Asian Thai Foods,Fatafat Chicken Flavor,Pack,Nepal,3.75
1433,Asian Thai Foods,Krrish Instant Noodles Vegetable Curry Flavor,Pack,Nepal,3.5
1434,Asian Thai Foods,Rumpum Vegetable Soup Base,Pack,Nepal,4.25
1435,Asian Thai Foods,Miteri Instant Noodles Chicken Flavor,Pack,Nepal,4.0
1436,Asian Thai Foods,Joker Ready To Eat Noodles,Pack,Nepal,3.25
1437,Asian Thai Foods,Preeti Instant Noodles Veg Soup Base,Pack,Nepal,5.0
1438,Asian Thai Foods,Gaurav Chicken Seasoning,Pack,Nepal,3.75
1439,Tablemark,Downtown Ramen Shop Shoyu,Pack,Japan,4.75
1440,Koka,Oriental Style Instant Noodles Crab Flavour,Pack,Singapore,3.75
1441,Nissin,Yakisoba,Pack,Japan,5.0
1442,Indomie,Instant Noodle Beef & Lime Flavour,Pack,Indonesia,4.25
1443,Hi-Myon,Katsuo Udon,Pack,South Korea,4.0
1444,Kamfen,E-Men Noodles Abalone Soup Flavor,Pack,Hong Kong,3.75
1445,Tesco,Everyday Value Spicy Curry Flavour Noodles,Cup,UK,1.5
1446,Wei Lih,Whats That? Leisure Meatballs Chicken Flavor,Pack,Taiwan,3.75
1447,Nissin,Big Cup Noodles Habanero Lime Shrimp Flavor Ramen Noodle Soup,Cup,United States,3.5
1448,Oyatsu,Baby Star Ramen Round Chikinmini,Pack,Japan,3.5
1449,Lucky Me!,Special Instant Pancit Bihon With Kalamansi,Pack,Philippines,3.25
1450,Campbell's,Hearty Noodles Chicken Flavour,Cup,Canada,2.75
1451,GaGa,Mie Jepeng Goreng Rasa Ayam Lada Hitam,Pack,Indonesia,4.0
1452,Myojo,Japanese Style Noodles Shio Flavor,Pack,United States,5.0
1453,Samyang Foods,Ganjjampong,Bowl,South Korea,4.25
1454,Maruchan,Fresh Yaki-Soba Stir Fry Noodles With Seasoning Sauce Base,Pack,Japan,4.25
1455,Nagao Noodle,Ramen Kamen Thasos Galle Pork Bone,Pack,Japan,4.25
1456,Sau Tao,Oat Noodle Sesame Oil Flavored,Pack,China,3.75
1457,ABC,Selera Pedas Mi Rebus Hot Gulai Flavor,Pack,Indonesia,4.75
1458,Ko-Lee,Taste Sensation Instant Noodles Curry Flavour,Pack,UK,3.75
1459,Mr. Noodles,Kimchi Bowl Noodles Oriental Noodle With Soup Base,Bowl,Canada,2.75
1460,Thai Pavilion,spicy Pad Thai Instant Noodles & Sauce,Tray,United States,4.25
1461,Tokyo Noodle,Mini Instant Noodles Artificial Chicken Flavor,Pack,Japan,5.0
1462,Nissin,Pan Asian Kitchen Sukiyaki Beef Flavor Savory Soy Sauce Ramen Noodles,Tray,United States,3.75
1463,Maitri,Vegetarian Fried Noodles (Mie Goreng),Pack,Indonesia,4.0
1464,Samyang Foods,Samyang Ramyun (SK Version),Cup,South Korea,3.5
1465,Mama,Oriental Style Instant Kua-Chap Clear Soup,Pack,Thailand,3.75
1466,Golden Wheat,Korean Style Stew Beef Cooking Noodle,Pack,China,3.25
1467,GS25,Gonghwachun Jjajangmyun,Pack,South Korea,4.5
1468,La Fonte,Spaghetti With Bolognese Sauce,Box,Indonesia,4.25
1469,Chencun,Spicy Beef,Cup,China,3.5
1470,Nissin,Demae Ramen Kimchi Flavour Instant Noodle With Soup Base,Bowl,Hong Kong,3.5
1471,Nissin,Raoh Rich Soy Sauce With Roast Pork (2 Slices),Bowl,Japan,4.5
1472,Nongshim,Doong Ji Authentic Korean Cold Noodles With Chili Sauce,Tray,South Korea,5.0
1473,Western Family,Instant Noodles Chicken Flavour,Pack,Canada,3.5
1474,Myojo,Ippei-chan Yomise No Yakisoba Teriyaki Mayo Flavor,Tray,Japan,5.0
1475,Batchelors,Super Noodles Mild Mexican Chilli,Pack,UK,3.0
1476,Eat & Go,Spicy Chicken Mi Instan Cup,Cup,Indonesia,4.25
1477,Baltix,Instant Noodles With Chicken Flavour Broth,Pack,Estonia,3.75
1478,Baltix,Instant Noodles With Beef Flavour Broth,Pack,Estonia,3.25
1479,Tropicana Slim,Low Fat Noodles Hainan Chicken,Pack,Indonesia,3.75
1480,Amianda,Homely Dried Noodles - Sesame Pate,Pack,Taiwan,3.75
1481,Amianda,Tachia Noodles - Hot & Spicy Sauce,Pack,Taiwan,3.5
1482,Amianda,Tachia Dried Noodles - Fried Shallot,Pack,Taiwan,3.25
1483,Amianda,Thin Noodles - Sesame Oil,Pack,Taiwan,4.25
1484,Amianda,Hakka Flat Noodles - Satay Sauce,Pack,Taiwan,4.5
1485,Amianda,Tachia Dried Noodles - Rou Zhou Meat Sauce,Pack,Taiwan,5.0
1486,Amianda,Homely Dried Noodles - Original Flavor ,Pack,Taiwan,4.0
1487,Amianda,Dried Noodles - Spicy Sauerkraut,Pack,Taiwan,3.25
1488,Amianda,Hakka Flat Noodles - Fried Bean Sauce,Pack,Taiwan,4.25
1489,Amianda,Tachia Dried Noodles - Peppery,Pack,Taiwan,3.75
1490,MyKuali,Penang White Curry Noodle,Pack,Malaysia,5.0
1491,Sawadee,Indian Curry Flavour,Pack,UK,3.0
1492,Vina Acecook,Hao Hao Mi Goreng Shrimp & Onion Flavour,Pack,Vietnam,3.5
1493,Mr. Noodles,Noodles In A Cup Chicken Simulated Flavour,Cup,Canada,1.5
1494,Nissin,GooTa Demi Hamburg-Men,Cup,Japan,4.75
1495,Indomie,Mi Goreng Cabe Ijo,Pack,Indonesia,4.5
1496,Deshome,Aloe Noodle Sesame Sauce,Pack,Taiwan,3.25
1497,Deshome,Black Eyed Beans Noodle Basil Sauce & Sesame Sauce,Pack,Taiwan,3.5
1498,Deshome,Aloe Noodle Vegetable Sauce,Pack,Taiwan,5.0
1499,Deshome,Black Eyed Beans Noodle Spicy Soybean Sauce & Sesame Sauce,Pack,Taiwan,3.75
1500,Deshome,Aloe Noodle Red Onion & Sesame Sauce,Pack,Taiwan,5.0
1501,Deshome,Black Eyed Beans Noodle Vegetable Sauce & Sesame Sauce,Pack,Taiwan,3.75
1502,Deshome,Aloe Noodle With Basil Sauce,Pack,Taiwan,5.0
1503,Deshome,Pollen Noodles Sesame Sauce & Soy Sauce,Pack,Taiwan,4.25
1504,Deshome,Black Eyed Bean Noodle Red Onion Sauce & Sesame Sauce,Pack,Taiwan,3.75
1505,Deshome,Aloe Noodle With Spicy Soybean Sauce,Pack,Taiwan,4.0
1506,Nissin,Raoh Soy Sauce Taste,Pack,Japan,4.0
1507,HoMyeonDang,Premium Noodle House Pork & Seafood Flavor,Pack,South Korea,4.0
1508,Nissin,Raoh Rich Miso Flavor,Bowl,Japan,5.0
1509,Koka,Oriental Instant Noodles Stir Fried Noodles,Pack,Singapore,3.75
1510,Nissin,Cup Noodle Red Shock,Cup,Japan,3.75
1511,Tasty Bite,1 Step-1 Minute Asian Noodles Pad Thai,Pack,United States,3.5
1512,Tasty Bite,1 Step-1 Minute Asian Noodles Kung Pao,Pack,United States,4.25
1513,Tasty Bite,1 Step-1 Minute Asian Noodles Mushroom Lo Mein,Pack,United States,4.0
1514,Tasty Bite,1 Step-1 Minute Asian Noodles Thai Basil,Pack,United States,3.75
1515,Tasty Bite,1 Step-1 Minute Asian Noodles Lemongrass Ginger,Pack,United States,3.75
1516,Tasty Bite,1 Step-1 Minute Asian Noodles Toasted Sesame,Pack,United States,4.0
1517,Star Anise Foods,Happy Pho Vietnamese Brown Rice Noodle Soup Garlic Goodness,Pack,United States,3.75
1518,Mamee,Oriental Noodles Curry Flavour,Pack,Malaysia,3.25
1519,A-Sha Dry Noodle,Dry Noodle Mandarin Noodle - Original Sauce,Pack,Taiwan,4.0
1520,A-Sha Dry Noodle,Dry Noodle Hakka Noodle - Spicy Sesame Oil Sauce,Pack,Taiwan,3.5
1521,A-Sha Dry Noodle,Dry Noodle Mandarin Noodle - Onion Oil Sauce,Pack,Taiwan,5.0
1522,A-Sha Dry Noodle,Dry Noodle QQ Thin Noodle - BBQ Sauce,Pack,Taiwan,5.0
1523,A-Sha Dry Noodle,No. 10 Mandarin Noodle - Black Pepper Sauce,Pack,Taiwan,3.75
1524,A-Sha Dry Noodle,Dry Noodle Tainan Noodle - Sesame Sauce,Pack,Taiwan,4.0
1525,A-Sha Dry Noodle,Dry Noodle Hakka Noodle - Chili Sauce,Pack,Taiwan,4.25
1526,Maruchan,Seimen Japanese Instant Ramen Noodles Soy Sauce Taste,Pack,Japan,3.75
1527,Knorr,Japanese Pork Bone Flavour Quick Serve Macaroni,Pack,Hong Kong,3.0
1528,Mr. Noodles,Bowl Beef Simulated Flavor,Bowl,Canada,2.0
1529,Ottogi,Cheese Bokki,Cup,South Korea,3.5
1530,New Touch,Yakisoba Noodle,Tray,Japan,4.0
1531,Myojo,Stir Fry Noodles Japanese Style Noodles With Sauce,Pack,United States,4.0
1532,Nissin,Chow Mein Chicken,Tray,United States,3.5
1533,Nongshim,Shin Ramyun Noodle Spicy Mushroom,Bowl,China,3.25
1534,Chewy,Rice Vermicelli Satay Chicken,Pack,China,3.0
1535,Nongshim,Potato Pork Ramyun,Pack,China,5.0
1536,Ko-Lee,Instant Noodles Super Chow Mein,Pack,UK,4.0
1537,Western Family,Instant Noodles Vegetable Flavour,Pack,Canada,1.0
