,Brand,Variety,Style,Country,Stars
776,Nissin,Cup Noodles Ramen Noodles Ramen Noodle Soup Beef Flavor (New Package) ,Cup,United States,3.5
777,Baijia,Spicy Artificial Fei Chang Instant Vermicelli (New Recipe),Pack,China,3.75
778,Crystal Noodle,Soup All Natural Hot & Sour,Cup,United States,0.25
779,Thai Smile,Spring Onion Rice Noodle Soup Bowl,Bowl,United States,2.5
780,iMee,Instant Noodles Vegetable Flavour,Pack,Netherlands,2.75
781,Wai Wai,Instant Rice Vermicelli Crab Flavour,Pack,Thailand,3.5
782,Fujiwara,Salty Taste Chanko Noodle,Pack,Japan,4.75
783,Azami,Kimchee Flavour Noodle Soup,Pack,Canada,0.0
784,Vit's,Shallot Chicken Instant Noodles,Pack,Malaysia,3.0
785,Cintan,Mi Segera Mmm... Perisa Asam Laksa,Pack,Malaysia,3.5
786,A1,Soup Spices Noodle Mee Rempahan Sup,Pack,Malaysia,3.5
787,Vit's,Tom Yam Instant Noodles,Pack,Malaysia,4.25
788,Super,Kimchi,Cup,Malaysia,4.5
789,Cintan,Mi Segera Mmm... Perisa Ayam Cendawan,Pack,Malaysia,3.5
790,Super,Curry Flavour Noodles,Cup,Malaysia,3.0
791,Pama,Kua Teaw Segera,Pack,Malaysia,4.0
792,Nissin,Chow Mein Premium Savory Sauce And Restaurant Quality Noodles Sriracha Flavor,Tray,United States,4.25
793,Super,Instant Noodles Black Pepper Crab Mi Goreng,Cup,Malaysia,3.5
794,Torishi,Hakata Tonkotsu Ramen,Pack,Japan,5.0
795,iMee,Instant Noodles Creamy Tom Yum Shrimp Flavour,Pack,Netherlands,4.5
796,Western Family,Beef Flavour Instant Noodles,Pack,Canada,0.0
797,MyKuali,Penang Hokkien Prawn Soup Rice Vermicelli (Bihun),Bowl,Malaysia,5.0
798,Pulmuone,Non-Fried Noodle Blackbean Sauce Noodle With Squid,Pack,South Korea,4.5
799,Chering Chang,Instant Non-Fried Noodles Tomato Flavour,Pack,Taiwan,3.25
800,JML,Spicy King Spicy Chicken,Pack,China,5.0
801,JML,Supereme Bowl Noodles With Stewed Egg Spicy Flavour,Bowl,China,3.5
802,JML,Spicy King Bowl Noodle Spicy Chicken,Bowl,China,5.0
803,JML,Spicy King Bowl Noodle Spicy Beef,Bowl,China,4.25
804,JML,Spicy King Spicy Pork,Pack,China,5.0
805,JML,Supreme Bowl Noodles With Stewed Egg Sour Beans With Pork Flavour,Bowl,China,4.0
806,JML,Spicy King Spicy Beef,Pack,China,5.0
807,JML,Supreme Bowl Noodles With Stewed Egg Braised Beef Flavour,Bowl,China,3.5
808,JML,Spicy King Bowl Noodle Spicy Pork,Bowl,China,4.5
809,Mamee,Chef Lontong Flavour,Pack,Malaysia,5.0
810,New Touch,Negi Miso No Ippin Ramen,Bowl,Japan,5.0
811,Mama,Instant Noodles Shrimp Tom Yum Flavour,Pack,Cambodia,4.0
812,Paldo,Bulnak Boeummyun King Noodle,Bowl,South Korea,3.5
813,Nissin,Cup Noodles Ramen Noodles With Shrimp (New Package) ,Cup,United States,3.5
814,Pirkka,Nuudeli Tom Yum Katkarapu,Pack,Finland,3.75
815,Ishimaru,Tuna Flavor Ramen,Pack,Japan,4.5
816,Mom's Dry Noodle,Sesame & Pepper,Pack,Taiwan,4.0
817,Authentically Asian,Natural Quality Foods Pad Thai Noodle Bowl,Bowl,United States,1.0
818,New Touch,Homestyle Tonjiru,Bowl,Japan,4.5
819,Nissin,Cup Noodles Moo Manao Flavour,Cup,Thailand,4.0
820,Vit's,Duck Instant Noodles,Pack,Malaysia,3.5
821,iMee,Instant Noodles Beef Flavour,Pack,Netherlands,3.25
822,A-Sha Dry Noodle,Veggie Noodle Carrot Noodle With Original Sauce,Pack,Taiwan,4.25
823,Mama,Oriental Style Instant Noodles Hot & Spicy Flavour,Pack,Bangladesh,4.0
824,Paldo,King Bowl Super Spicy Pan Stirfried Noodle,Bowl,South Korea,5.0
825,Thai Smile,Garlic Rice Noodle Soup Bowl,Bowl,United States,3.5
826,Kuriki,Mayo Ramen,Pack,Japan,4.75
827,Mom's Dry Noodle,Spicy & Sour Flavor,Pack,Taiwan,5.0
828,Mi Sedaap,Instant Cup Mi Kuah Rasa Soto,Cup,Indonesia,5.0
829,Yum Yum,Jumbo Instant Noodles Tom Yum Kung Creamy Flavour,Pack,Thailand,5.0
830,Azami,Chili Chicken Flavour Noodle Soup,Cup,Canada,3.0
831,Vit's,Curry Instant Noodles,Pack,Malaysia,3.5
832,Marutai,Ramen Shoyu Taste,Bowl,Japan,4.25
833,Unox,Good Noodles Kerrie,Pack,Netherlands,3.5
834,A-Sha Dry Noodle,Veggie Noodle Baby Grass Noodle With Toona Sauce,Pack,Taiwan,5.0
835,Mama,Rangers Snack Noodles Shrimp Tom Yum Flavour,Pack,Myanmar,4.5
836,Aroi,Curry Me! Penang White Curry Stir-fry Noodle,Pack,Malaysia,4.5
837,Myojo,Udon Japanese Style Pre-Cooked Noodles With Soup Chicken Flavor,Bowl,United States,2.5
838,Master Kong,Braised Beef Noodle,Pack,China,4.25
839,Nissin,Raoh Tanrei Koku Shio Ramen,Bowl,Japan,4.5
840,Little Cook,Instant Noodles Shrimp Tom Yum Flavour,Cup,Thailand,4.25
841,Mi Sedaap,Instant Cup Mi Goreng,Cup,Indonesia,3.75
842,Mamee,Monster Snek Mi Pedas,Pack,Malaysia,5.0
843,Master Kong,Tomato Sauce Instant Noodle,Bowl,China,4.0
844,Koka,Laksa Singapura,Pack,Singapore,4.25
845,Bonasia,Instant Noodles Beef Flavour,Pack,Germany,3.75
846,Super,Seafood Flavour Noodles,Cup,Malaysia,3.25
847,Mama,Instant Noodles Creamy Shrimp Tom Yum Flavour,Pack,Cambodia,5.0
848,Wu-Mu,BBQ Pork Flavor Chow Mein,Pack,Taiwan,4.5
849,Vedan,Zan Vegetarian Instant Noodle Series Shiitake Mushroom Flavour,Cup,Taiwan,2.75
850,Yamadai,Tenobe Somen,Bowl,Japan,3.25
851,Wei Lih,Jah Jan Men,Bowl,Taiwan,5.0
852,Vina Acecook,Oh! Ricey Pho Ga,Bowl,Vietnam,3.0
853,A-Sha Dry Noodle,Veggie Noodle Black Sesame Noodle,Pack,Taiwan,3.25
854,Pirkka,Nuudeli Liha Nudlar Kott,Pack,Finland,3.5
855,Baixiang Noodles,Artificial Beef Instant Noodles With Soup Base,Pack,China,3.75
856,CarJEN,Otentiq Cheezy Curry Instant Noodles,Pack,Malaysia,4.5
857,Salam Mie,Mi Goreng Dengan Abon,Pack,Indonesia,4.25
858,Mamee,Chef Lontong Flavour,Cup,Malaysia,5.0
859,Wai Wai,Grilled Pork Flavour Instant Noodles,Bowl,Thailand,2.5
860,Vina Acecook,Hao Hao Sate Onion Flavour,Cup,Vietnam,2.5
861,Lee Fah Mee,Sarawak White Laksa Instant Noodle,Pack,Sarawak,4.0
862,Mama,Instant Noodles Egg Protein Noodles,Pack,Myanmar,3.5
863,Yum Yum,Instant Noodles Minced Pork Flavor,Pack,Thailand,3.75
864,Master Kong,Sichuan Hot Spicy Fish,Pack,China,3.75
865,CarJEN,Otentiq Cheezy Mushroom Instant Noodles,Pack,Malaysia,5.0
866,Sakurai Foods,Organic Miso Ramen,Pack,Japan,4.5
867,Hao Way,Vegetarian Penang Laksa,Pack,Malaysia,4.0
868,Chering Chang,Instant Non-Fried Noodles Vegetable Curry Flavor,Pack,Taiwan,5.0
869,Asia Gold,Instant Noodles With Shrimp Flavouring,Pack,Hungary,4.0
870,The Kitchen Food,Sibu Instant Kampua Original,Pack,Sarawak,4.0
871,Azami,Hot & Spicy Flavour Noodle Soup,Bowl,Canada,3.5
872,Maggi,Hot Cup Goreng Perencah Cili Fiesta,Cup,Malaysia,4.75
873,Premiere,Gold Bihun Kari Heritage Instant Rice Vermicelli,Pack,Malaysia,4.5
874,Baixiang Noodles,Sour & Spicy Flavour,Pack,China,3.75
875,7 Select/Nissin,Super Tom Yum Shrimp,Cup,Thailand,3.5
876,Samyang Foods,Seafood Noodle,Cup,Japan,2.75
877,Sakurai Foods,Organic Shoyu Ramen,Pack,Japan,4.25
878,A-Sha Dry Noodle,Hakka Flat Noodle With Za Jiang Sauce,Pack,Taiwan,4.0
879,Vit's,Mi goreng Pedas Chewy & springy,Pack,Malaysia,3.5
880,Maruchan,Instant Lunch Chicken Tortilla Flavor Ramen Noodles With Vegetables,Cup,United States,4.0
881,The Kitchen Food,Instant Kampua Dark Soy Sauce,Pack,Sarawak,5.0
882,Mama,Cup Yentafo Tom Yum Mohfai,Cup,Thailand,5.0
883,Mama,Cup Shrimp Creamy Tom Yum,Cup,Thailand,5.0
884,Mama,Instant Rice Vermicelli Bihun Goreng Original Flavour,Pack,Thailand,4.75
885,Mama,Instant Noodles coconut Milk Flavour,Cup,Myanmar,5.0
886,Mama,Oriental Style Instant Noodles Chicken Flavour,Pack,Bangladesh,3.25
887,Mama,Instant Cup Noodles Minced Prok Flavor,Cup,Thailand,3.5
888,Wugudaochang,Sour Bamboo Shoot & Beef If Hot Pot Flavor Noodles,Bowl,China,4.0
889,Wugudaochang,Tomato Beef Brisket Flavor Purple Potato Noodle,Pack,China,5.0
890,Wugudaochang,Sea Tangle & Sparerins Flavor Noodles,Bowl,China,3.75
891,Wugudaochang,Chef's Grains Millet Noodle,Pack,China,3.75
892,Wugudaochang,Chef's Grains Buckwheat Noodle,Pack,China,3.5
893,Wugudaochang,Chef's Grains Pea Noodle,Pack,China,4.0
894,Wugudaochang,Sichuan Pepper & Chicken Flavor Noodle,Bowl,China,4.5
895,Wugudaochang,Sour Soup & Minced Meat Flavor Chef's Grain Naked Oat Noodles,Pack,China,5.0
896,Wugudaochang,Sour Bamboo Shoot & Beef If Hot Pot Flavor Noodles,Pack,China,4.0
897,Wugudaochang,Sea Tangle & Sparerins Flavor Noodles,Bowl,China,3.75
898,Aroi,Curry Me! Penang White Curry Soup Noodle,Pack,Malaysia,4.5
899,Ten-In,Veggie World Vegetarian Braised Beef Instant Noodles,Bowl,Taiwan,3.5
900,Nongshim,Shin Black Spicy Po-Au-Feu Flavor (Mew Edition),Pack,United States,5.0
901,Paldo,Raobokki Noodle (Export Version),Pack,South Korea,5.0
902,A1,Emporer Herbs Chicken Noodle,Pack,Malaysia,4.25
903,Baixiang Noodles,Sauerkraut Flavor,Pack,China,4.5
904,Emart,Dare You! Habanero Ramen (New Edition),Cup,South Korea,3.5
905,Lishan Food Manufacturing,Black Cock Brand Vegetarian Chicken Noodle,Pack,Taiwan,3.5
906,Azami,Chili Seafood Flavor Noodle Soup,Cup,Canada,3.25
907,Ah Lai,Penang Favourite White Curry Rice Vermicelli,Pack,Malaysia,5.0
908,Tropicana Slim,Less Fat Noodles Grilled Chicken,Pack,Indonesia,3.75
909,A-One,Mi Ly Instant Noodles Mi Chay Vegetarian Flavor,Cup,Vietnam,1.25
910,Mama,Cup Rice Vermicelli With Clear Soup,Cup,Thailand,3.5
911,Deshome,Aloe Thin Noodles With Camelia Oil Vegetable Sauce Flavor,Pack,Taiwan,5.0
912,Vifon,Curry Instant Noodle With Chicken,Cup,Vietnam,3.0
913,Paldo Vina,Koreno Premium Mushroom Flavor,Pack,Vietnam,1.5
914,Mamee,Oriental Noodles Prawn Flavor,Pack,Malaysia,2.0
915,Vina Acecook,King Chef Authentic Kimchi Flavour,Pack,Vietnam,4.0
916,Mama,Non-Fried Instant Noodles Ramen Tonkotsu Flavor,Pack,Thailand,5.0
917,Chencun,Senior Food Rice Noodle Fragrant Peppery Beef,Cup,China,3.75
918,Sau Tao,Ho Fan Wonton Soup Flavored,Pack,Hong Kong,3.0
919,United,Xi Gon Satay Onion Flavor,Pack,Vietnam,2.75
920,ChoripDong,Hurricane Rice Cake (Topokki),Bowl,South Korea,5.0
921,Shan,Shoop Instant Noodles Bombay Biryani Flavour,Pack,Pakistan,2.75
922,Mama,JokCup Instant Porridge Soup Seafood Flavour,Cup,Thailand,3.5
923,Baijia,Artificial Pickled Vegetable Beef Flavor,Pack,China,3.0
924,MyOri,Malaysia Penang White Curry Noodle Super Spicy,Pack,Malaysia,5.0
925,MyOri,Malaysia Penang Green Curry Rice Vermicelli,Pack,Malaysia,5.0
926,MyOri,Malaysia Penang White Curry Noodle Original,Pack,Malaysia,5.0
927,Ruski,Chicken Flavour Instant Noodles,Pack,Malaysia,3.75
928,Ottogi,Sesame Flavor Ramen Korean Style Instant Noodle,Pack,South Korea,4.25
929,Master Kong,Seafood Flavour Instant Cooking Noodles,Pack,China,4.25
930,Wei Lih,Instant Noodles With Onion Flavour,Pack,Taiwan,4.25
931,No Name,Shrimp Flavour Oriental Noodles And Soup Mix,Cup,Canada,2.75
932,New Way,Spaghetti Instant Noodles,Tray,Vietnam,4.0
933,Lucky Me!,Supreme Jjamppong Korean Style Spicy Seafood Soup,Bowl,Philippines,3.75
934,Hao Way,Vegetarian Penang Laksa Instant Bowl Noodles,Bowl,Malaysia,2.0
935,Emart,Dare You! Habanero Jjajang Ramen,Cup,South Korea,3.5
936,Campbell's,Hearty Noodles Savoury Beef Flavour,Cup,Canada,0.25
937,One Dish Asia,Japanese Ramen Noodle,Bowl,United States,0.0
938,Long Jun Hang,Taiwan Dried Noodles With Onion Oil Sauce,Pack,Taiwan,2.0
939,Pama,Bihun Creamy Tom Yam Flavour,Cup,Malaysia,3.75
940,A-Sha Dry Noodle,Veggie Noodle Tomato Noodle With Vine Ripened Tomato Sauce,Pack,Taiwan,5.0
941,Thai Chef,Instant Nudelsuppe Huhn Geschmack,Pack,Germany,3.0
942,Shan,Shoop Instant Noodles Masala Flavour,Pack,Pakistan,3.25
943,Wai Wai,Quick Zabb Tom Klong Flavour Instant Noodles,Pack,Thailand,2.75
944,Samyang Foods,Shoyu Noodle,Cup,South Korea,3.5
945,A-One,Mi Ly Instant Noodles Mi Bo Beef Flavor,Cup,Vietnam,3.5
946,Cintan,Mi Segera Mmm... Perisa Kari,Pack,Malaysia,3.0
947,Nissin,Donbei Tempura Soba Mini,Bowl,Japan,4.0
948,Nongshim,Korean Clay Pot Ramyun,Bowl,China,2.5
949,Hao Way,Penang Laksa Instant Bowl Noodles,Bowl,Malaysia,3.5
950,Azami,Kimchee Noodle Soup,Cup,Canada,0.0
951,Vedan,Wei Wei A Instant Noodles Hot Beef Flavour,Bowl,Taiwan,2.5
952,Nissin,Gonbuto Kistune Udon,Bowl,Japan,2.75
953,Mama,Instant Rice Noodle Soup Spicy Shrimp Flavour,Bowl,Thailand,5.0
954,Baixiang Noodles,Artificial Pork Flavour,Pack,China,3.0
955,MyKuali,Penang White Curry Noodle (New Improved Tatse),Pack,Malaysia,5.0
956,Nongshim,Quick2 Hot & Spicy Noodle Soup With Habanero & Lime,Pack,United States,4.0
957,Myojo,MenWhite Creamy Tonkotsu,Bowl,Japan,3.0
958,Premiere,Gold Penang Asam Laksa Bihun,Pack,Malaysia,3.25
959,Nissin,Chu Qian Yi Ding Tom Yum Instant Noodles With Soup Base,Pack,Singapore,3.75
960,Deshome,Aloe This Noodles With Camellia Oil Spicy Bean Sauce Flavor,Pack,Taiwan,2.5
961,MyKuali,Penang Hokkien Prawn Noodle (New Improved Taste),Pack,Malaysia,5.0
962,Unif-100,Instant Noodles Artificial Spicy Beef Flavor (New Package),Pack,China,3.5
963,Hankow,Shanghai Kaiyang Noodle,Pack,China,4.0
964,The Bridge,Penang White Curry Noodle,Pack,Malaysia,5.0
965,Maruchan,Kaoru Maitake Tempura Udon,Bowl,Japan,3.25
966,Shan,Shoop Instant Noodles Spicy Lemon Flavour,Pack,Pakistan,3.25
967,Lucky Me!,Supreme Seafood Flavor Big Cup,Bowl,Philippines,4.0
968,Paldo Vina,Koreno Premium Ginseng Flavor,Pack,Vietnam,3.0
969,Mitoku,Brown Rice Ramen,Pack,Japan,0.25
970,Hao Way,Penang Vegetarian Prawn Instant Noodles,Pack,Malaysia,4.5
971,Myojo,Nyumen Desse Shoyu,Bowl,Japan,2.75
972,Maggi,Perencah Kari Letup Mi Segera,Pack,Malaysia,4.0
973,Nissin,Demae Iccho Mushroom With Vegetables Flavour Macaroni,Pack,Hong Kong,3.5
974,Unzen,Mushroom Honpo Shiitake Nutritious Noodle,Pack,Japan,1.0
975,Salam Mie,Mi Goreng Ala Jawa Dengan Sambal Cabe Asli,Pack,Indonesia,5.0
976,Vina Acecook,Mikochi Tom Yum Flavor Instant Noodles,Pack,Vietnam,3.5
977,Nongshim,Jinjja Jinjja (New),Pack,South Korea,5.0
978,Chering Chang,Instant Non-Fried Noodles Shallot Pork Flavour,Pack,Taiwan,5.0
979,Nissin,Top Ramen Super Noodles Tomato,Pack,India,3.5
980,Mama,Cup Rice Vermicelli Shrimp Creamy Tom Yum,Cup,Thailand,4.0
981,Nissin,Original Chow Mein Premium Spicy Chicken Flavor,Tray,United States,4.0
982,Uncle Sun,White Curry Noodle More Spicy,Pack,Malaysia,3.0
983,JML,Emporer Instant Noodles Spicy Chicken,Pack,China,5.0
984,Acecook,Jan Jan Dashi Shoyu Yakisoba,Cup,Japan,2.25
985,Nongshim,Tteokgukmyun,Pack,South Korea,4.25
986,Mom's Dry Noodle,Vegan Chilli With Sesame Sauce,Pack,Taiwan,5.0
987,Mi E-Zee,Perisa Sayuran,Pack,Malaysia,3.5
988,Mi E-Zee,Perisa Kari Sayuran,Pack,Malaysia,3.75
989,E-mi,Mi Perencah Ayam Jagung,Pack,Malaysia,3.75
990,Mi E-Zee,Perisa Bayam,Pack,Malaysia,3.5
991,J.J.,Snek Mi Perisa Ayam,Pack,Malaysia,3.75
992,CarJEN,Nyonya Curry Laksa,Pack,Malaysia,5.0
993,E-mi,Mi Perencah Asam Pedas,Pack,Malaysia,3.75
994,J.J.,Snek Mi Perisa BBQ,Pack,Malaysia,4.0
995,Mi E-Zee,Perisa Kari / Curry Flavour,Pack,Malaysia,4.0
996,United,3 Con Tom Instant Noodles Thailand Sour Shrimp Flavor,Pack,Vietnam,2.75
997,Emart,Dare You! Habanero Ramen (New Edition),Pack,South Korea,3.75
998,Curry Prince,Penang Authentic White Curry Noodle,Pack,Malaysia,4.0
999,Nissin,Gonbuto Tempura Udon,Bowl,Japan,4.0
1000,Mama,Pork Flavour Whole Wheat Noodle,Pack,Thailand,3.75
1001,Maggi,Authentic Indian Noodles Vegetable Atta Masala,Pack,India,3.75
1002,Paldo,Jjajangmen Chajang Noodle King Bowl,Bowl,South Korea,5.0
1003,Chering Chang,Steam Vegetarian Flavor Noodles,Pack,Taiwan,3.5
1004,Hao Way,Penang White Curry Instant Bowl Noodles,Bowl,Malaysia,4.75
1005,Master Kong,Artificial Seafood Flavor Instant Noodle,Pack,China,3.75
1006,Econsave,Choice Instant Noodles Curry Flavour,Pack,Malaysia,3.5
1007,Maruchan,"Big Cup Ramen Corn, Salt & Butter Flavor",Bowl,Japan,5.0
1008,Maggi,Mi Goreng Perencah Kari Ori,Pack,Malaysia,4.0
1009,Mama,Instant Noodles Cup Beef Flavour,Cup,Thailand,3.5
1010,Nissin,Emergency Cup Noodle,Cup,Japan,4.25
1011,Nissin,Cup Noodles Tomato Enjoy Noodles With Hot Soup,Cup,India,3.25
1012,Oyatsu,Baby Star Snack Noodle Chicken Flavour,Pack,Japan,2.5
1013,A-One,M Ly Instant Noodles M Tht Xo Pork Flavor,Cup,Vietnam,3.0
1014,Nongshim,Shin Ramyun Noodle Soup (New Edition),Pack,United States,4.25
1015,Koka,Purple Wheat Noodles Soy & Vinegar Flavor,Pack,Singapore,2.75
1016,Uncle Sun,White Curry Noodle,Pack,Malaysia,4.5
1017,Kin-Dee,Instant Rice Noodle Spicy Seafood,Tray,Thailand,3.75
1018,Master Kong,Spicy Beef Flavor Instant Noodle,Pack,China,4.0
1019,No Name,Beef Flavour Oriental Noodles And Soup Mix,Cup,Canada,2.0
1020,Hao Way,Penang Laksa ,Pack,Malaysia,3.5
1021,Ching's Secret,Hot Garlic Instant Noodles,Pack,India,3.75
1022,Ko-Lee,Instant Noodles Taste Sensation Mixed Vegetable Flavour,Pack,UK,3.5
1023,ICA,Asia Fast Noodles Snabbnudlar Rksmak,Pack,Sweden,3.0
1024,Mamee,Mi Segera Perisa Itik,Pack,Malaysia,3.75
1025,Bamee,Oriental Style Instant Noodles Pa-Lo Duck Flavour,Pack,Thailand,3.5
1026,Myojo,Men Black Seafood Tonkotsu,Bowl,Japan,3.5
1027,Ibumie,Penang White CurryMee,Pack,Malaysia,5.0
1028,Sapporo Ichiban,Chow Mein Japanese Style Noodles Yakisoba,Pack,Canada,5.0
1029,Samyang Foods,Curry Noodle,Cup,Japan,3.75
1030,Vedan,Volcano Spicy Pork Noodle,Bowl,Taiwan,4.25
1031,Nissin,Demae Rice Vermicelli Beef Flavour,Pack,Hong Kong,3.5
1032,Nanyang Chef,Penang Asam Pedas Hot & Sour Noodle,Pack,Malaysia,5.0
1033,Thai Pavilion,Pad Thai Instant rice Noodles & Sauce,Tray,United States,1.5
1034,Maggi,2 Minute Noodles Hungrooo Masala Spicy,Pack,India,3.75
1035,Koka,Noodles Beef Flavour,Cup,Singapore,2.5
1036,Wu-Mu,Steam Pork Flavour,Pack,Taiwan,3.75
1037,Unif-100,Instant Noodles Artificial Shallot Beef Flavour,Pack,China,4.25
1038,New Touch,Kimchi Noodle,Bowl,Japan,3.5
1039,Sau Tao,Oat Noodle Tomato Soup Flavored,Pack,Hong Kong,4.5
1040,Wai Wai,Quick Zabb Chili Paste Tom Yum Flavour Instant Noodles,Pack,Thailand,3.75
1041,Paldo Vina,Koreno Premium Shrimp Flavor,Pack,Vietnam,3.25
1042,Sau Tao,Oat Noodle Pork Rib Flavored,Pack,Hong Kong,3.5
1043,Vit's,Seafood Instant Noodles,Pack,Malaysia,3.75
1044,Miliket,Sate Flavor Instant Noodles,Pack,Vietnam,3.75
1045,Lucky Me!,Special Instant Noodles Jjamppong Flavor,Pack,Philippines,4.5
1046,Lucky Me!,Special Instant sopas Chicken Flavor,Pack,Philippines,3.75
1047,Lucky Me!,Spicy Beef Mami Instant Noodle Soup,Pack,Philippines,4.0
1048,Lucky Me!,Special Instant Curly Spaghetti With Yummy Red Sauce,Pack,Philippines,4.0
1049,Lucky Me!,Supreme Pinoy Chicken Instant Noodles,Cup,Philippines,3.25
1050,Lucky Me!,Special Baked Mac Style Instant Macaroni,Pack,Philippines,4.5
1051,Lucky Me!,La Paz Batchoy Instant Noodle Soup,Pack,Philippines,3.75
1052,Pama,Instant Kua Teow Tom Yam,Cup,Malaysia,3.75
1053,Nissin,Chu Qian Yi Ding Spicy Sesame Flavour Instant Noodles With Soup Base,Pack,Singapore,3.5
1054,Paldo,Jjamppong Seafood Noodle King Bowl,Bowl,South Korea,5.0
1055,Vifon,Instant Porridge Seafood Flavour,Pack,Vietnam,3.25
1056,Maruchan,Gotsumori Sauce Yakisoba,Tray,Japan,5.0
1057,Yum Yum,Oriental Style Instant Noodles Wasabi Flavour,Pack,Thailand,3.0
1058,Ching's Secret,Manchurian Instant Noodles,Pack,India,3.5
1059,Mamee,Chef Gold Recipe Bihun Kari Seribu Rasa,Pack,Malaysia,4.5
1060,Katoz,Instant Noodles Spicy Chili,Pack,Sweden,3.5
1061,Men-Sunaoshi,Miso Ramen,Pack,Japan,3.75
1062,Nongshim,Neoguri Udon Seafood & Mild,Pack,South Korea,4.0
1063,Maggi,Royale Penang Seafood Curry,Pack,Malaysia,4.5
1064,Mama,Instant Noodles Tom Yum Pork Flavour,Pack,Thailand,4.0
1065,Chewy,Japanese Fried Ramen Noodles Kyoto Barbecue Sauce Flavour,Pack,Hong Kong,1.75
1066,Long Jun Hang,Tainan Yi Mien With Sesame Oil Sauce,Pack,Taiwan,3.25
1067,Knorr,Quick Serve Macaroni Wonton Broth,Pack,Hong Kong,3.25
1068,Nissin,Donbei Kitsune Udon Mini,Bowl,Japan,3.5
1069,Mamee,Chef Gold Recipe Mi Kari Seribu Rasa,Pack,Malaysia,5.0
1070,Nissin,Chu Qian Yi Ding Prawn Flavour Instant Noodles With Soup Base,Pack,Singapore,3.5
1071,Nissin,Cup Noodles Mug Noodles Spicy Vegetable,Pack,India,3.75
1072,Shan,Shoop Instant Noodles BBQ Flavour,Pack,Pakistan,3.25
1073,Master Kong,Stewed Beef Flavor Cooking Noodle,Pack,China,4.25
1074,Nongshim,Bowl Noodle Soup Shrimp Habanero Lime Flavor,Bowl,United States,3.25
1075,JML,Artificial Pork Flavor Noodles,Pack,China,4.0
1076,Acecook,Ohmori Chukafu Yakisoba,Tray,Japan,3.25
1077,MyKuali,Penang Red Tom Yum Goong Noodle,Pack,Malaysia,5.0
1078,United,Instant Noodles Xi Gon Artificial Stewed Beef Flavor,Pack,Vietnam,3.25
1079,Samyang Foods,Sogokimyun Hot Flavor Noodle Soup,Pack,South Korea,3.5
1080,Nissin,Easy Fideos Picante Lime Shrimp Flavor Ramen Noodle Soup,Cup,United States,3.5
1081,Master Kong,Mianba Pork Ribs Flavor Instant Noodles,Pack,China,4.5
1082,Super,Instant Noodles Mee Goreng,Cup,Malaysia,3.75
1083,Indomie,Pop Mie Chicken Flavour Cup Noodles,Cup,Indonesia,3.5
1084,Maruchan,Magomi-an Kitsune Udon (Eastern Japan Flavor),Bowl,Japan,4.25
1085,Wai Wai,Quick Zabb Tom Yum Shrimp Flavour Instant Noodles,Pack,Thailand,4.0
1086,Ottogi,Potato Ramen,Pack,South Korea,3.75
1087,Nissin,Soba Chili Noodles With Japanese Yakisoba Sauce,Cup,Germany,3.5
1088,Maggi,Multigrainz Noodles Spice Remix,Pack,India,3.25
1089,Mom's Dry Noodle,Sichuan Spicy Flavor,Pack,Taiwan,5.0
1090,ICA,Asia Snabbnudlar Kycklingsmak,Pack,Sweden,3.25
1091,Mom's Dry Noodle,Onion Oil & Shrimp Flavor,Pack,Taiwan,5.0
1092,Nongshim,Spicy Tonkotsu Noodle Soup,Pack,United States,5.0
1093,Ibumie,Mee Baa..Gus Mi Goreng Spicier Original Flavour,Pack,Malaysia,3.75
1094,Four Seas,Hot & Spicy Instant Noodle (Mushroom & Beef Flavour),Pack,Hong Kong,4.0
1095,Maruchan,I Want To Eat Ramen' Shoyu Flavor,Pack,Japan,4.0
1096,Master Kong,Mushroom Stew Chicken Ramen,Pack,China,3.5
1097,Paldo,Jjol Bibim Men,Pack,South Korea,4.0
1098,Nissin,Cup Noodles Easy Fideos Tomato Chicken Flavor Ramen Noodle Soup,Cup,United States,3.5
1099,Ruski,Tom Yam Flavour Instant Noodles,Pack,Thailand,4.0
1100,Mama,Instant Noodles Moo Nam Tok Flavour,Pack,Thailand,4.0
1101,Thai Chef,Instant Nudelsuppe Shrimp Flavour,Pack,Germany,3.5
1102,Bamee,Cup Oriental Style Instant Noodles Chicken Flavour,Cup,Thailand,3.25
1103,Mama,Instant Noodle Shrimp Tom Yum Flavour Jumbo Pack,Pack,Thailand,4.0
1104,Mama,Instant Cup Noodles Shrimp Tom Yum Flavour (Extreme),Cup,Thailand,5.0
1105,Ruski,Chicken Masala Flavour Instant Fried Noodles,Pack,Thailand,3.75
1106,Mama,Instant Noodles Shrimp Creamy Tom Yum Flavour Jumbo Pack,Pack,Thailand,5.0
1107,Mama,Instant Cup Noodles Spicy Cheese Flavour,Cup,Thailand,3.5
1108,Bamee,Oriental Style Instant Noodles Beef Flavour,Pack,Germany,3.25
1109,Mama,Instant Cup Noodles Seafood Pad Kee Mao Flavour,Cup,Thailand,5.0
1110,Ruski,Creamy Tom Yam Instant Noodles,Pack,Thailand,4.5
1111,Mama,Oriental Style Instant Noodles Green Curry Flavour Jumbo Pack,Pack,Thailand,5.0
1112,Thai Chef,"Shrimp ""Tom Yum"" Instant Nudelsuppe",Pack,Germany,3.5
1113,Nanyang Chef,Penang White curry Noodle With Nanyang Chilli Paste,Pack,Malaysia,4.75
1114,Maruchan,Instant Lunch California Vegetable Ramen Noodles With Vegetables,Cup,United States,3.5
1115,Wei Lih,Steam Instant Noodles Korean Salt & Rib Soup Flavour,Bowl,Taiwan,2.25
1116,Nissin,Cup Noodles Black Pepper Crab Flavour,Cup,Singapore,4.0
1117,Nissin,Premium Instant Noodles Spicy Beef Flavour,Pack,Singapore,3.75
1118,Nissin,Cup Noodles Tom Yam Veg Flavour,Cup,Singapore,4.0
1119,Nissin,Premium Instant Noodles Roasted Beef Flavour,Bowl,Singapore,3.75
1120,Nissin,Chu Qian Yi Ding Sesame Oil Flavour,Pack,Singapore,3.75
1121,Nissin,Cup Noodles Chicken Flavour,Cup,Singapore,3.5
1122,Nissin,Premium Instant Noodles XO Sauce Seafood Flavour,Pack,Singapore,3.75
1123,Nissin,Cup Noodles Chilli Crab Flavour,Cup,Singapore,4.0
1124,Nissin,Japanese Ramen Kyushu Black Instant Noodles With Soup Base,Pack,Singapore,5.0
1125,Nissin,Premium Instant Noodles Spicy Beef Flavour,Bowl,Singapore,3.75
1126,Nissin,Cup Noodles Tom Yam Seafood Flavour,Cup,Singapore,4.0
1127,Nissin,Japanese Ramen Tokyo Shoyu Instant Noodles With Soup Base,Pack,Singapore,5.0
1128,Nissin,Cup Noodles Seafood Curry Flavour,Cup,Singapore,4.0
1129,Nissin,Premium Instant Noodles Roasted Beef Flavour,Pack,Singapore,4.25
1130,Nissin,Cup Noodles Cream Of Chicken Flavour,Cup,Singapore,4.0
1131,Myojo,Ippei-Chan Jumbo Night Market Style Yakisoba,Tray,Japan,4.5
1132,MyKuali,Penang Hokkien Prawn Noodle,Pack,Malaysia,5.0
1133,Maruchan,Instant Lunch Jalapeno Cheddar Flavor Ramen Noodles,Cup,United States,3.5
1134,Nongshim,Harmony Korean Spicy Noodle Dish With Chipotle,Pack,United States,4.25
1135,Maggi,2 Minute Noodles Tom Yam Flavour,Pack,Singapore,3.5
1136,Nissin,Souper Meal Chili Picante Chicken With Lime Flavor Ramen Noodle Soup,Bowl,United States,3.5
1137,Wu-Mu,Dried Noodle With Beef Flavor Sauce,Pack,Taiwan,3.0
1138,Adabi,Mi Segera Mi Goreng Pedas Instant Noodles,Pack,Malaysia,3.5
1139,Maruchan,Old Style Miso Ramen,Pack,Japan,3.5
1140,Knorr,Quick Serve Macaroni Abalone & Chicken Flavour,Pack,Hong Kong,3.0
1141,Chencun,Rice Noodle Beef With Brown Sauce,Cup,China,3.5
1142,Maggi,2 Minute Noodles Assam Laksa Flavour,Pack,Singapore,4.0
1143,Maggi,Hot Cup Perisa Kari,Cup,Malaysia,3.5
1144,Maggi,2 Minute Noodles Curry Flavour,Pack,Singapore,3.75
1145,Maggi,Senses Laksa Instant Noodles,Pack,Singapore,5.0
1146,Maggi,Extra Spicy Curry Instant Noodles,Pack,Singapore,5.0
1147,Samyang Foods,Buldak Bokkummyeon,Bowl,South Korea,4.0
1148,Nissin,Sabor A Gallina Fideos Con Instantanea,Pack,Colombia,3.5
1149,Myojo,Chukazanmai Beijing Style Salt Ramen,Pack,Japan,3.0
1150,Osaka Ramen,Miso Ramen,Bowl,United States,3.75
1151,Ottogi,Cheese Bokki,Bowl,South Korea,4.0
1152,Hao Way,Instant Penang White Curry Noodles,Pack,Malaysia,4.5
1153,Sainsbury's,Curry Flavour Instant Noodles,Pack,UK,1.5
1154,Vina Acecook,King Chef Seafood With Kimchi Flavour,Pack,Vietnam,3.0
1155,Nissin,Pan Asian Kitchen Spicy Szechuan Chicken Flavor Ramen Noodles,Tray,United States,3.0
1156,Nongshim,Korean Clay Pot Ramyun Noodle,Cup,China,2.75
1157,Maruchan,I Want To Eat Ramen Shio,Pack,Japan,3.75
1158,Vifon,Ngon-Ngon Tom Yum Minced Pork Noodle,Cup,Vietnam,3.5
1159,Ottogi,Ppushu Ppushu Grilled Chicken Flavor,Pack,South Korea,1.0
1160,Sau Tao,Oat Noodle Abalone Flavored,Pack,Taiwan,1.75
1161,Myojo,Chukazanmai Szechuan Style Miso,Pack,Japan,2.0
